Started by user [8mha:////4J8JrJht7t7A7SriVTzQOlM2hmQuW/E1CIxqbiJ3dqs5AAAAmR+LCAAAAAAAAP9b85aBtbiIQTGjNKU4P08vOT+vOD8nVc83PyU1x6OyILUoJzMv2y+/JJUBAhiZGBgqihhk0NSjKDWzXb3RdlLBUSYGJk8GtpzUvPSSDB8G5tKinBIGIZ+sxLJE/ZzEvHT94JKizLx0a6BxUmjGOUNodHsLgAzOEgZe/dLi1CL90rzsvPzyPACFlOLawgAAAA==[0manonymous
Building in workspace C:\Jenkins\workspace\Guest_Online
[Guest_Online] $ cmd.exe /C "mvn -f C:\BDDAutomationFramework\JavaSeleniumFramework\pom.xml verify && exit %%ERRORLEVEL%%"
[INFO] Scanning for projects...
[INFO] 
[INFO] ------------------------------------------------------------------------
[INFO] Building onlineAutomation 1.0-SNAPSHOT
[INFO] ------------------------------------------------------------------------
[8mha:////4FgVpCH/S5kjhM4aKaNEG8D32LVTzuWrGPC5JYx/R2KUAAAAYx+LCAAAAAAAAP9b85aBtbiIQSWjNKU4P0+vJLE4u1gvPjexLDVPzxdEhicW5WXmpfvll6S2fNly5fzGzauYGBgqihikoFqS8/OK83NS9ZwhNEghAwQwghQWAACwxA+XYgAAAA==[0m[WARNING] The POM for org.eclipse.jetty.websocket:websocket-client:jar:9.4.5.v20170502 is invalid, transitive dependencies (if any) will not be available, enable debug logging for more details
[8mha:////4FgVpCH/S5kjhM4aKaNEG8D32LVTzuWrGPC5JYx/R2KUAAAAYx+LCAAAAAAAAP9b85aBtbiIQSWjNKU4P0+vJLE4u1gvPjexLDVPzxdEhicW5WXmpfvll6S2fNly5fzGzauYGBgqihikoFqS8/OK83NS9ZwhNEghAwQwghQWAACwxA+XYgAAAA==[0m[WARNING] The POM for org.eclipse.jetty:jetty-client:jar:9.4.5.v20170502 is invalid, transitive dependencies (if any) will not be available, enable debug logging for more details
[8mha:////4FgVpCH/S5kjhM4aKaNEG8D32LVTzuWrGPC5JYx/R2KUAAAAYx+LCAAAAAAAAP9b85aBtbiIQSWjNKU4P0+vJLE4u1gvPjexLDVPzxdEhicW5WXmpfvll6S2fNly5fzGzauYGBgqihikoFqS8/OK83NS9ZwhNEghAwQwghQWAACwxA+XYgAAAA==[0m[WARNING] The POM for org.eclipse.jetty:jetty-http:jar:9.4.5.v20170502 is invalid, transitive dependencies (if any) will not be available, enable debug logging for more details
[8mha:////4FgVpCH/S5kjhM4aKaNEG8D32LVTzuWrGPC5JYx/R2KUAAAAYx+LCAAAAAAAAP9b85aBtbiIQSWjNKU4P0+vJLE4u1gvPjexLDVPzxdEhicW5WXmpfvll6S2fNly5fzGzauYGBgqihikoFqS8/OK83NS9ZwhNEghAwQwghQWAACwxA+XYgAAAA==[0m[WARNING] The POM for org.eclipse.jetty:jetty-io:jar:9.4.5.v20170502 is invalid, transitive dependencies (if any) will not be available, enable debug logging for more details
[8mha:////4FgVpCH/S5kjhM4aKaNEG8D32LVTzuWrGPC5JYx/R2KUAAAAYx+LCAAAAAAAAP9b85aBtbiIQSWjNKU4P0+vJLE4u1gvPjexLDVPzxdEhicW5WXmpfvll6S2fNly5fzGzauYGBgqihikoFqS8/OK83NS9ZwhNEghAwQwghQWAACwxA+XYgAAAA==[0m[WARNING] The POM for org.eclipse.jetty:jetty-util:jar:9.4.5.v20170502 is invalid, transitive dependencies (if any) will not be available, enable debug logging for more details
[8mha:////4FgVpCH/S5kjhM4aKaNEG8D32LVTzuWrGPC5JYx/R2KUAAAAYx+LCAAAAAAAAP9b85aBtbiIQSWjNKU4P0+vJLE4u1gvPjexLDVPzxdEhicW5WXmpfvll6S2fNly5fzGzauYGBgqihikoFqS8/OK83NS9ZwhNEghAwQwghQWAACwxA+XYgAAAA==[0m[WARNING] The POM for org.eclipse.jetty.websocket:websocket-api:jar:9.4.5.v20170502 is invalid, transitive dependencies (if any) will not be available, enable debug logging for more details
[8mha:////4FgVpCH/S5kjhM4aKaNEG8D32LVTzuWrGPC5JYx/R2KUAAAAYx+LCAAAAAAAAP9b85aBtbiIQSWjNKU4P0+vJLE4u1gvPjexLDVPzxdEhicW5WXmpfvll6S2fNly5fzGzauYGBgqihikoFqS8/OK83NS9ZwhNEghAwQwghQWAACwxA+XYgAAAA==[0m[WARNING] The POM for org.eclipse.jetty.websocket:websocket-common:jar:9.4.5.v20170502 is invalid, transitive dependencies (if any) will not be available, enable debug logging for more details
[8mha:////4FgVpCH/S5kjhM4aKaNEG8D32LVTzuWrGPC5JYx/R2KUAAAAYx+LCAAAAAAAAP9b85aBtbiIQSWjNKU4P0+vJLE4u1gvPjexLDVPzxdEhicW5WXmpfvll6S2fNly5fzGzauYGBgqihikoFqS8/OK83NS9ZwhNEghAwQwghQWAACwxA+XYgAAAA==[0m[WARNING] The POM for org.apache.httpcomponents:httpcore:jar:4.3.3 is invalid, transitive dependencies (if any) will not be available, enable debug logging for more details
[8mha:////4FgVpCH/S5kjhM4aKaNEG8D32LVTzuWrGPC5JYx/R2KUAAAAYx+LCAAAAAAAAP9b85aBtbiIQSWjNKU4P0+vJLE4u1gvPjexLDVPzxdEhicW5WXmpfvll6S2fNly5fzGzauYGBgqihikoFqS8/OK83NS9ZwhNEghAwQwghQWAACwxA+XYgAAAA==[0m[WARNING] The artifact org.apache.commons:commons-io:jar:1.3.2 has been relocated to commons-io:commons-io:jar:1.3.2
[INFO] 
[8mha:////4FeHgFSRyne1GA3PpjwbR1R8tgg2WwLe4OMTA4Du3+jlAAAAYB+LCAAAAAAAAP9b85aBtbiIQSmjNKU4P0+vJLE4u1gvPjexLDVPzxdEGvvmZ+X75ZekLlOVfvTjc8FPJgaGiiIGKaiG5Py84vycVD1nCA1SyAABjCCFBQCV27OjYAAAAA==[0m[INFO] --- maven-resources-plugin:2.7:resources (default-resources) @ onlineAutomation ---
[INFO] Using 'UTF-8' encoding to copy filtered resources.
[INFO] Copying 7 resources
[INFO] 
[8mha:////4FeHgFSRyne1GA3PpjwbR1R8tgg2WwLe4OMTA4Du3+jlAAAAYB+LCAAAAAAAAP9b85aBtbiIQSmjNKU4P0+vJLE4u1gvPjexLDVPzxdEGvvmZ+X75ZekLlOVfvTjc8FPJgaGiiIGKaiG5Py84vycVD1nCA1SyAABjCCFBQCV27OjYAAAAA==[0m[INFO] --- maven-compiler-plugin:2.5.1:compile (default-compile) @ onlineAutomation ---
[INFO] Nothing to compile - all classes are up to date
[INFO] 
[8mha:////4FeHgFSRyne1GA3PpjwbR1R8tgg2WwLe4OMTA4Du3+jlAAAAYB+LCAAAAAAAAP9b85aBtbiIQSmjNKU4P0+vJLE4u1gvPjexLDVPzxdEGvvmZ+X75ZekLlOVfvTjc8FPJgaGiiIGKaiG5Py84vycVD1nCA1SyAABjCCFBQCV27OjYAAAAA==[0m[INFO] --- maven-resources-plugin:2.7:testResources (default-testResources) @ onlineAutomation ---
[INFO] Using 'UTF-8' encoding to copy filtered resources.
[INFO] Copying 7 resources
[INFO] 
[8mha:////4FeHgFSRyne1GA3PpjwbR1R8tgg2WwLe4OMTA4Du3+jlAAAAYB+LCAAAAAAAAP9b85aBtbiIQSmjNKU4P0+vJLE4u1gvPjexLDVPzxdEGvvmZ+X75ZekLlOVfvTjc8FPJgaGiiIGKaiG5Py84vycVD1nCA1SyAABjCCFBQCV27OjYAAAAA==[0m[INFO] --- maven-compiler-plugin:2.5.1:testCompile (default-testCompile) @ onlineAutomation ---
[INFO] Nothing to compile - all classes are up to date
[INFO] 
[8mha:////4FeHgFSRyne1GA3PpjwbR1R8tgg2WwLe4OMTA4Du3+jlAAAAYB+LCAAAAAAAAP9b85aBtbiIQSmjNKU4P0+vJLE4u1gvPjexLDVPzxdEGvvmZ+X75ZekLlOVfvTjc8FPJgaGiiIGKaiG5Py84vycVD1nCA1SyAABjCCFBQCV27OjYAAAAA==[0m[INFO] --- maven-surefire-plugin:2.17:test (default-test) @ onlineAutomation ---
[INFO] Surefire report directory: C:\BDDAutomationFramework\JavaSeleniumFramework\target\surefire-reports

-------------------------------------------------------
 T E S T S
-------------------------------------------------------
Running com.mab.test.datadriven.Test
Configuring TestNG with: TestNG652Configurator
Tests run: 0, Failures: 0, Errors: 0, Skipped: 0, Time elapsed: 0.476 sec - in com.mab.test.datadriven.Test

Results :

Tests run: 0, Failures: 0, Errors: 0, Skipped: 0

[INFO] 
[8mha:////4FeHgFSRyne1GA3PpjwbR1R8tgg2WwLe4OMTA4Du3+jlAAAAYB+LCAAAAAAAAP9b85aBtbiIQSmjNKU4P0+vJLE4u1gvPjexLDVPzxdEGvvmZ+X75ZekLlOVfvTjc8FPJgaGiiIGKaiG5Py84vycVD1nCA1SyAABjCCFBQCV27OjYAAAAA==[0m[INFO] --- maven-surefire-plugin:2.17:test (test) @ onlineAutomation ---
[INFO] Surefire report directory: C:\BDDAutomationFramework\JavaSeleniumFramework\target\surefire-reports

-------------------------------------------------------
 T E S T S
-------------------------------------------------------

-------------------------------------------------------
 T E S T S
-------------------------------------------------------
Running com.mab.test.runners.RunWebATSuite
Configuring TestNG with: TestNG652Configurator
@Smoke
Feature: Restaurant Search

  Scenario Outline: Find a nearby restaurant - Positive path           # Harvester/HomePage.feature:4
    Given The user is on the Harvester home page "<scenarioname>"
    When The user searches for a Restaurant with postcode "<postcode>"
    Then User can see the Restaurants page
    And The nearest outlet "<Restaurant>" is listed correctly

    Examples: 
-- listing properties --
profile.path=/profiles/jenkins/config.properties
-- listing properties --
jdbcUrl=jdbc:oracle:thin:@localhost:1521:STOREDB
testToRun=**/*WebATSuite*.class
iZone.user=555045mgr
driver.root.dir=tools
db.schedma=WCUSER_STG_OWNER
platform=win32
site.url=https://www.harvester.co.uk/
mab.jdbcUrl=jdbc:oracle:thin:@gbwynlpora006.mab.c...
jdbcUser=wcuser_owner
iZone.password=Sunshine1
browser=chrome
jdbcPwd=Db!4AppL
iZone.url=https://tables.izone-staging.com/user...
harvester.url=https://www.harvester.co.uk/
jdbcDriver=oracle.jdbc.OracleDriver
Starting ChromeDriver 2.33.506120 (e3e53437346286c0bc2d2dc9aa4915ba81d9023f) on port 49087
Only local connections are allowed.
Mar 05, 2018 10:35:31 AM org.openqa.selenium.remote.ProtocolHandshake createSession
INFO: Detected dialect: OSS
The user is on the Harvester home page
[main] INFO com.mab.test.pageobjects.mab.harvester.HarvesterHomePage -  Navigating to Harvester HomePage 

-- listing properties --
profile.path=/profiles/jenkins/config.properties
-- listing properties --
jdbcUrl=jdbc:oracle:thin:@localhost:1521:STOREDB
testToRun=**/*WebATSuite*.class
iZone.user=555045mgr
driver.root.dir=tools
db.schedma=WCUSER_STG_OWNER
platform=win32
site.url=https://www.harvester.co.uk/
mab.jdbcUrl=jdbc:oracle:thin:@gbwynlpora006.mab.c...
jdbcUser=wcuser_owner
iZone.password=Sunshine1
browser=chrome
jdbcPwd=Db!4AppL
iZone.url=https://tables.izone-staging.com/user...
harvester.url=https://www.harvester.co.uk/
jdbcDriver=oracle.jdbc.OracleDriver
HTML Report is stored in the path: C:\GOPlatform\TestExecutionLog\Harvester Online Booking:03-05_10-35-32.html
https://www.harvester.co.uk/

  @Smoke
  Scenario Outline: Find a nearby restaurant - Positive path                                     # Harvester/HomePage.feature:12
    Given The user is on the Harvester home page "Search with valid credentials - Positive path" # Harvester_Booking.the_user_is_on_the_Harvester_home_page(String)
      org.openqa.selenium.TimeoutException: Expected condition failed: waiting for element to be clickable: By.xpath: //a[contains(.,'Accept & Close')] (tried for 15 second(s) with 500 MILLISECONDS interval)
      Build info: version: '3.7.1', revision: '8a0099a', time: '2017-11-06T21:01:39.354Z'
      System info: host: 'PA40621', ip: '192.168.198.53', os.name: 'Windows 10', os.arch: 'amd64', os.version: '10.0', java.version: '1.8.0_162'
      Driver info: org.openqa.selenium.chrome.ChromeDriver
      Capabilities {acceptSslCerts: true, applicationCacheEnabled: false, browserConnectionEnabled: false, browserName: chrome, chrome: {chromedriverVersion: 2.33.506120 (e3e53437346286..., userDataDir: C:\Users\TESTAC~1\AppData\L...}, cssSelectorsEnabled: true, databaseEnabled: false, handlesAlerts: true, hasTouchScreen: false, javascriptEnabled: true, locationContextEnabled: true, mobileEmulationEnabled: false, nativeEvents: true, networkConnectionEnabled: false, pageLoadStrategy: normal, platform: XP, platformName: XP, rotatable: false, setWindowRect: true, takesHeapSnapshot: true, takesScreenshot: true, unexpectedAlertBehaviour: , unhandledPromptBehavior: , version: 64.0.3282.186, webStorageEnabled: true}
      Session ID: 8c3b66eb4e695b36c210936e53633f8b
      	at org.openqa.selenium.support.ui.WebDriverWait.timeoutException(WebDriverWait.java:82)
      	at org.openqa.selenium.support.ui.FluentWait.until(FluentWait.java:231)
      	at com.mab.test.framework.PageObject.waitForElementClickable(PageObject.java:173)
      	at com.mab.test.pageobjects.mab.harvester.HarvesterHomePage.gotoHomePage(HarvesterHomePage.java:65)
      	at com.mab.test.stepdefinitions.mab.harvester.booking.Harvester_Booking.the_user_is_on_the_Harvester_home_page(Harvester_Booking.java:34)
      	at ✽.Given The user is on the Harvester home page "Search with valid credentials - Positive path"(Harvester/HomePage.feature:5)

    When The user searches for a Restaurant with postcode "B31 JP"                               # Harvester_Booking.the_user_searches_for_a_Restaurant_with_postcode(String)
    Then User can see the Restaurants page                                                       # Harvester_Booking.user_can_see_the_Restaurants_page()
    And The nearest outlet "Star" is listed correctly                                            # Harvester_Booking.the_nearest_outlet_is_listed_correctly(String)

1 Scenarios (1 failed)
4 Steps (1 failed, 3 skipped)
0m36.952s

org.openqa.selenium.TimeoutException: Expected condition failed: waiting for element to be clickable: By.xpath: //a[contains(.,'Accept & Close')] (tried for 15 second(s) with 500 MILLISECONDS interval)
Build info: version: '3.7.1', revision: '8a0099a', time: '2017-11-06T21:01:39.354Z'
System info: host: 'PA40621', ip: '192.168.198.53', os.name: 'Windows 10', os.arch: 'amd64', os.version: '10.0', java.version: '1.8.0_162'
Driver info: org.openqa.selenium.chrome.ChromeDriver
Capabilities {acceptSslCerts: true, applicationCacheEnabled: false, browserConnectionEnabled: false, browserName: chrome, chrome: {chromedriverVersion: 2.33.506120 (e3e53437346286..., userDataDir: C:\Users\TESTAC~1\AppData\L...}, cssSelectorsEnabled: true, databaseEnabled: false, handlesAlerts: true, hasTouchScreen: false, javascriptEnabled: true, locationContextEnabled: true, mobileEmulationEnabled: false, nativeEvents: true, networkConnectionEnabled: false, pageLoadStrategy: normal, platform: XP, platformName: XP, rotatable: false, setWindowRect: true, takesHeapSnapshot: true, takesScreenshot: true, unexpectedAlertBehaviour: , unhandledPromptBehavior: , version: 64.0.3282.186, webStorageEnabled: true}
Session ID: 8c3b66eb4e695b36c210936e53633f8b
	at org.openqa.selenium.support.ui.WebDriverWait.timeoutException(WebDriverWait.java:82)
	at org.openqa.selenium.support.ui.FluentWait.until(FluentWait.java:231)
	at com.mab.test.framework.PageObject.waitForElementClickable(PageObject.java:173)
	at com.mab.test.pageobjects.mab.harvester.HarvesterHomePage.gotoHomePage(HarvesterHomePage.java:65)
	at com.mab.test.stepdefinitions.mab.harvester.booking.Harvester_Booking.the_user_is_on_the_Harvester_home_page(Harvester_Booking.java:34)
	at ✽.Given The user is on the Harvester home page "Search with valid credentials - Positive path"(Harvester/HomePage.feature:5)

Tests run: 1, Failures: 1, Errors: 0, Skipped: 0, Time elapsed: 38.474 sec <<< FAILURE! - in com.mab.test.runners.RunWebATSuite
run_cukes(com.mab.test.runners.RunWebATSuite)  Time elapsed: 37.884 sec  <<< FAILURE!
cucumber.runtime.CucumberException: org.openqa.selenium.TimeoutException: Expected condition failed: waiting for element to be clickable: By.xpath: //a[contains(.,'Accept & Close')] (tried for 15 second(s) with 500 MILLISECONDS interval)
Build info: version: '3.7.1', revision: '8a0099a', time: '2017-11-06T21:01:39.354Z'
System info: host: 'PA40621', ip: '192.168.198.53', os.name: 'Windows 10', os.arch: 'amd64', os.version: '10.0', java.version: '1.8.0_162'
Driver info: org.openqa.selenium.chrome.ChromeDriver
Capabilities {acceptSslCerts: true, applicationCacheEnabled: false, browserConnectionEnabled: false, browserName: chrome, chrome: {chromedriverVersion: 2.33.506120 (e3e53437346286..., userDataDir: C:\Users\TESTAC~1\AppData\L...}, cssSelectorsEnabled: true, databaseEnabled: false, handlesAlerts: true, hasTouchScreen: false, javascriptEnabled: true, locationContextEnabled: true, mobileEmulationEnabled: false, nativeEvents: true, networkConnectionEnabled: false, pageLoadStrategy: normal, platform: XP, platformName: XP, rotatable: false, setWindowRect: true, takesHeapSnapshot: true, takesScreenshot: true, unexpectedAlertBehaviour: , unhandledPromptBehavior: , version: 64.0.3282.186, webStorageEnabled: true}
Session ID: 8c3b66eb4e695b36c210936e53633f8b
	at cucumber.api.testng.TestNGCucumberRunner.runCukes(TestNGCucumberRunner.java:48)
	at cucumber.api.testng.AbstractTestNGCucumberTests.run_cukes(AbstractTestNGCucumberTests.java:14)
	at sun.reflect.NativeMethodAccessorImpl.invoke0(Native Method)
	at sun.reflect.NativeMethodAccessorImpl.invoke(Unknown Source)
	at sun.reflect.DelegatingMethodAccessorImpl.invoke(Unknown Source)
	at java.lang.reflect.Method.invoke(Unknown Source)
	at org.testng.internal.MethodInvocationHelper.invokeMethod(MethodInvocationHelper.java:85)
	at org.testng.internal.MethodInvocationHelper$1.runTestMethod(MethodInvocationHelper.java:200)
	at cucumber.api.testng.AbstractTestNGCucumberTests.run(AbstractTestNGCucumberTests.java:19)
	at org.testng.internal.MethodInvocationHelper.invokeHookable(MethodInvocationHelper.java:212)
	at org.testng.internal.Invoker.invokeMethod(Invoker.java:689)
	at org.testng.internal.Invoker.invokeTestMethod(Invoker.java:882)
	at org.testng.internal.Invoker.invokeTestMethods(Invoker.java:1189)
	at org.testng.internal.TestMethodWorker.invokeTestMethods(TestMethodWorker.java:124)
	at org.testng.internal.TestMethodWorker.run(TestMethodWorker.java:108)
	at org.testng.TestRunner.privateRun(TestRunner.java:767)
	at org.testng.TestRunner.run(TestRunner.java:617)
	at org.testng.SuiteRunner.runTest(SuiteRunner.java:348)
	at org.testng.SuiteRunner.runSequentially(SuiteRunner.java:343)
	at org.testng.SuiteRunner.privateRun(SuiteRunner.java:305)
	at org.testng.SuiteRunner.run(SuiteRunner.java:254)
	at org.testng.SuiteRunnerWorker.runSuite(SuiteRunnerWorker.java:52)
	at org.testng.SuiteRunnerWorker.run(SuiteRunnerWorker.java:86)
	at org.testng.TestNG.runSuitesSequentially(TestNG.java:1224)
	at org.testng.TestNG.runSuitesLocally(TestNG.java:1149)
	at org.testng.TestNG.run(TestNG.java:1057)
	at org.apache.maven.surefire.testng.TestNGExecutor.run(TestNGExecutor.java:115)
	at org.apache.maven.surefire.testng.TestNGDirectoryTestSuite.executeSingleClass(TestNGDirectoryTestSuite.java:128)
	at org.apache.maven.surefire.testng.TestNGDirectoryTestSuite.execute(TestNGDirectoryTestSuite.java:112)
	at org.apache.maven.surefire.testng.TestNGProvider.invoke(TestNGProvider.java:112)
	at org.apache.maven.surefire.booter.ForkedBooter.invokeProviderInSameClassLoader(ForkedBooter.java:200)
	at org.apache.maven.surefire.booter.ForkedBooter.runSuitesInProcess(ForkedBooter.java:153)
	at org.apache.maven.surefire.booter.ForkedBooter.main(ForkedBooter.java:103)
Caused by: org.openqa.selenium.TimeoutException: Expected condition failed: waiting for element to be clickable: By.xpath: //a[contains(.,'Accept & Close')] (tried for 15 second(s) with 500 MILLISECONDS interval)
Build info: version: '3.7.1', revision: '8a0099a', time: '2017-11-06T21:01:39.354Z'
System info: host: 'PA40621', ip: '192.168.198.53', os.name: 'Windows 10', os.arch: 'amd64', os.version: '10.0', java.version: '1.8.0_162'
Driver info: org.openqa.selenium.chrome.ChromeDriver
Capabilities {acceptSslCerts: true, applicationCacheEnabled: false, browserConnectionEnabled: false, browserName: chrome, chrome: {chromedriverVersion: 2.33.506120 (e3e53437346286..., userDataDir: C:\Users\TESTAC~1\AppData\L...}, cssSelectorsEnabled: true, databaseEnabled: false, handlesAlerts: true, hasTouchScreen: false, javascriptEnabled: true, locationContextEnabled: true, mobileEmulationEnabled: false, nativeEvents: true, networkConnectionEnabled: false, pageLoadStrategy: normal, platform: XP, platformName: XP, rotatable: false, setWindowRect: true, takesHeapSnapshot: true, takesScreenshot: true, unexpectedAlertBehaviour: , unhandledPromptBehavior: , version: 64.0.3282.186, webStorageEnabled: true}
Session ID: 8c3b66eb4e695b36c210936e53633f8b
	at org.openqa.selenium.support.ui.WebDriverWait.timeoutException(WebDriverWait.java:82)
	at org.openqa.selenium.support.ui.FluentWait.until(FluentWait.java:231)
	at com.mab.test.framework.PageObject.waitForElementClickable(PageObject.java:173)
	at com.mab.test.pageobjects.mab.harvester.HarvesterHomePage.gotoHomePage(HarvesterHomePage.java:65)
	at com.mab.test.stepdefinitions.mab.harvester.booking.Harvester_Booking.the_user_is_on_the_Harvester_home_page(Harvester_Booking.java:34)
	at ?.Given The user is on the Harvester home page "Search with valid credentials - Positive path"(Harvester/HomePage.feature:5)


Results :

Failed tests: 
  RunWebATSuite>AbstractTestNGCucumberTests.run:19->AbstractTestNGCucumberTests.run_cukes:14  Cucumber

Tests run: 1, Failures: 1, Errors: 0, Skipped: 0

[8mha:////4LyYvwmMdOC2dmjv/X01kKRPz1Rr3PD0S2ruYzGLiA8FAAAAYB+LCAAAAAAAAP9b85aBtbiIQSmjNKU4P0+vJLE4u1gvPjexLDVPzxdEuhYV5Rf55ZekOlc7RKnPKH7IxMBQUcQgBdWQnJ9XnJ+TqucMoUEKGSCAEaSwAACsNFCqYAAAAA==[0m[ERROR] There are test failures.

Please refer to C:\BDDAutomationFramework\JavaSeleniumFramework\target\surefire-reports for the individual test results.
[INFO] 
[INFO] >>> exec-maven-plugin:1.2.1:java (default) > validate @ onlineAutomation >>>
[INFO] 
[INFO] <<< exec-maven-plugin:1.2.1:java (default) < validate @ onlineAutomation <<<
[INFO] 
[INFO] 
[8mha:////4FeHgFSRyne1GA3PpjwbR1R8tgg2WwLe4OMTA4Du3+jlAAAAYB+LCAAAAAAAAP9b85aBtbiIQSmjNKU4P0+vJLE4u1gvPjexLDVPzxdEGvvmZ+X75ZekLlOVfvTjc8FPJgaGiiIGKaiG5Py84vycVD1nCA1SyAABjCCFBQCV27OjYAAAAA==[0m[INFO] --- exec-maven-plugin:1.2.1:java (default) @ onlineAutomation ---
[INFO] 
[INFO] --- maven-cucumber-reporting:0.0.8:generate (execution) @ onlineAutomation ---
[8mha:////4FgVpCH/S5kjhM4aKaNEG8D32LVTzuWrGPC5JYx/R2KUAAAAYx+LCAAAAAAAAP9b85aBtbiIQSWjNKU4P0+vJLE4u1gvPjexLDVPzxdEhicW5WXmpfvll6S2fNly5fzGzauYGBgqihikoFqS8/OK83NS9ZwhNEghAwQwghQWAACwxA+XYgAAAA==[0m[WARNING] C:\BDDAutomationFramework\JavaSeleniumFramework\target\cucumber-report\cucumber.json does not exist.
[INFO] 
[8mha:////4FeHgFSRyne1GA3PpjwbR1R8tgg2WwLe4OMTA4Du3+jlAAAAYB+LCAAAAAAAAP9b85aBtbiIQSmjNKU4P0+vJLE4u1gvPjexLDVPzxdEGvvmZ+X75ZekLlOVfvTjc8FPJgaGiiIGKaiG5Py84vycVD1nCA1SyAABjCCFBQCV27OjYAAAAA==[0m[INFO] --- maven-jar-plugin:2.4:jar (default-jar) @ onlineAutomation ---
[INFO] Building jar: C:\BDDAutomationFramework\JavaSeleniumFramework\target\onlineAutomation-1.0-SNAPSHOT.jar
[INFO] ------------------------------------------------------------------------
[INFO] BUILD SUCCESS
[INFO] ------------------------------------------------------------------------
[INFO] Total time: 49.667 s
[INFO] Finished at: 2018-03-05T10:36:08Z
[INFO] Final Memory: 15M/245M
[INFO] ------------------------------------------------------------------------
[CucumberReport] Preparing Cucumber Reports
[CucumberReport] JSON report directory is "C:\BDDAutomationFramework\JavaSeleniumFramework\target\cucumber-report"
[CucumberReport] Copied 1 json files from workspace "C:\BDDAutomationFramework\JavaSeleniumFramework\target\cucumber-report" to reports directory "C:\Jenkins\jobs\Guest_Online\builds\11\cucumber-html-reports\.cache"
[CucumberReport] Copied 0 properties files from workspace "C:\BDDAutomationFramework\JavaSeleniumFramework\target\cucumber-report" to reports directory "C:\Jenkins\jobs\Guest_Online\builds\11\cucumber-html-reports\.cache"
[CucumberReport] Processing 1 json files:
[CucumberReport] C:\Jenkins\jobs\Guest_Online\builds\11\cucumber-html-reports\.cache\runwebat\cucumber.json
[CucumberReport] Found 1 failed steps, while expected not more than 0
[CucumberReport] Build status is left unchanged
Finished: SUCCESS
